facility_name,category,region,source_bucket,label,reservation_required,price_note,target_age_note,guide_url,reservation_url,official_domain,evidence_note,status_note
국립중앙박물관 어린이박물관,어린이박물관,용산구,PDF 후보군(공식 웹 검증),예약가능,Y,무료,어린이 동반 관람 / 36개월 미만 포함 예약 필요,https://www.museum.go.kr/MUSEUM/contents/M0104010000.do?schM=child&act=intro,https://www.museum.go.kr/MUSEUM/contents/M0104010000.do?schM=child&act=intro,museum.go.kr,공식 예약 안내 페이지에서 온라인 예약·무료·14일 전 예약 가능 확인,개인/단체 탭 분리
서울역사 어린이박물관,어린이박물관,종로구,PDF 후보군(공식 웹 검증),예약가능,Y,무료,"초등 3~4학년 중심, 형제자매 동반 가능",https://museum.seoul.go.kr/chd/watch/watchGuide.jsp,https://museum.seoul.go.kr/chd/exhibition/exhibitionResv.jsp,museum.seoul.go.kr,공식/공식검색 결과 기준 온라인 사전 예약제·무료 확인,"서울시 ID 필요, 특정 기간 휴관 가능"
국립민속박물관 어린이박물관,어린이박물관,종로구,PDF 후보군(공식 웹 검증),예약가능,Y,무료,"어린이 대상, 단체는 최대 40명",https://www.nfm.go.kr/kids/main.do,https://www.nfm.go.kr/kids/nfmkid/exhibition/selectReserveView.do,nfm.go.kr,공식 페이지에서 전시 관람 예약·무료·1인 1일 1회 확인,매일 오전 9시 기준 2주 내 예약 오픈 안내 존재
국립어린이과학관,어린이과학관,종로구,PDF 후보군(공식 웹 검증),예약가능,Y,유료 가능,"어린이 중심, 보호자 동반 권장",https://www.csc.go.kr/new1/reservation/guide.jsp,https://www.csc.go.kr/new1/reservation/reservation_person.jsp,csc.go.kr,공식 예약 안내에서 상설전시관/천체투영관 개인 예약 확인,요금/상영 프로그램별 상이
서울상상나라,체험형 어린이시설,광진구,PDF 후보군(공식 웹 검증),예약가능,Y,유료 가능,영유아~초등 저학년 중심,https://www.seoulchildrensmuseum.org/,https://www.seoulchildrensmuseum.org/reservation/individualregistration.do,seoulchildrensmuseum.org,공식 개인예약 페이지 존재 확인,회차/전시·프로그램별 운영 상이
광나루안전체험관,안전체험관,광진구,PDF 후보군(공식 웹 검증),예약가능,Y,무료,어린이~청소년 / 일부 보호자 동반 필요,https://fire.seoul.go.kr/gwangnaru/main/main.do,https://fire.seoul.go.kr/gwangnaru/main/main.do,fire.seoul.go.kr,공식 도메인 및 검색 결과 기준 인터넷 사전예약 필수/현장 일부 가능 확인,프로그램별 연령 제한 확인 필요
보라매안전체험관,안전체험관,동작구,PDF 후보군(공식 웹 검증),예약가능,Y,무료,어린이 포함 가족 단위 가능,https://fire.seoul.go.kr/boramea/main/main.do,https://fire.seoul.go.kr/boramea/main/main.do,fire.seoul.go.kr,공식 도메인 및 검색 결과 기준 온라인 사전예약 확인,아동 적합 프로그램별 필터링 필요
서울식물원,식물원/체험시설,강서구,PDF 후보군(공식 웹 검증),단순안내,N/부분,일반 입장 유료/현장 가능,가족 단위 전 연령,https://botanicpark.seoul.go.kr/,https://yeyak.seoul.go.kr/web/reservation/selectReservView.do?rsv_svc_id=S260211174747511695,botanicpark.seoul.go.kr,일반 입장은 현장/온라인 가능하나 상시 사전예약 시설로 보긴 어려움,교육/해설 프로그램 단위로 신청형 분리 필요
